{"alerts":[],"dt":0.1,"duration":300.0,"final":{"ci":0.580074956592247,"ci_bonus":0.0290037478296123,"pps":0.422744139715486,"storage":40.9547730903289,"wallet":200.0},"preset":"early_farm","samples":[{"active_cells":19.0,"ci":0.541030695423836,"ci_bonus":0.0270515347711918,"ci_delta":-0.000252326308877393,"power_ratio":1.02768851584971,"pps":2.5333258628111,"storage":2.7858498695988,"time":1.1,"wallet":0.0},{"active_cells":21.75,"ci":0.542368545190588,"ci_bonus":0.0271184272595294,"ci_delta":0.542368545190588,"power_ratio":1.02830553545741,"pps":0.422501973217438,"storage":5.10881861637217,"time":2.1,"wallet":0.0},{"active_cells":27.25,"ci":0.543919573033702,"ci_bonus":0.0271959786516851,"ci_delta":0.000607848255255616,"power_ratio":1.02892241973139,"pps":0.42278733107038,"storage":5.53147607314039,"time":3.1,"wallet":0.0},{"active_cells":32.25,"ci":0.545912567446919,"ci_bonus":0.0272956283723459,"ci_delta":0.00069070171351715,"power_ratio":1.02953910102333,"pps":0.423081741990216,"storage":5.95442027658242,"time":4.1,"wallet":0.0},{"active_cells":34.0,"ci":0.546603269160436,"ci_bonus":0.0273301634580218,"ci_delta":0.00069070171351715,"power_ratio":1.03015551170717,"pps":0.423349255197627,"storage":6.37764987168142,"time":5.1,"wallet":0.0},{"active_cells":34.0,"ci":0.547818546938214,"ci_bonus":0.0273909273469107,"ci_delta":0.0,"power_ratio":1.03077158418655,"pps":0.423627458681781,"storage":6.80116341963627,"time":6.09999999999999,"wallet":0.0},{"active_cells":34.0,"ci":0.547818546938214,"ci_bonus":0.0273909273469107,"ci_delta":0.0,"power_ratio":1.03138725090216,"pps":0.42388045263948,"storage":7.22493004012546,"time":7.09999999999999,"wallet":0.0},{"active_cells":34.0,"ci":0.547818546938214,"ci_bonus":0.0273909273469107,"ci_delta":0.0,"power_ratio":1.03200244433923,"pps":0.424133249326901,"storage":7.6489495483617,"time":8.09999999999999,"wallet":0.0},{"active_cells":36.75,"ci":0.547573491716123,"ci_bonus":0.0273786745858062,"ci_delta":0.0000915868926689711,"power_ratio":1.03261709703484,"pps":0.42438075975671,"storage":8.07321673813986,"time":9.09999999999998,"wallet":0.0},{"active_cells":41.0,"ci":0.548521871192553,"ci_bonus":0.0274260935596276,"ci_delta":0.000335959250427509,"power_ratio":1.03323114158542,"pps":0.424652674821245,"storage":8.49774849926696,"time":10.1,"wallet":0.0},{"active_cells":48.75,"ci":0.549511031442216,"ci_bonus":0.0274755515721108,"ci_delta":0.000475120283078057,"power_ratio":1.03384451065404,"pps":0.424925176065015,"storage":8.92255127330009,"time":11.1,"wallet":0.0},{"active_cells":57.0,"ci":0.552473844095058,"ci_bonus":0.0276236922047529,"ci_delta":0.0016196368142084,"power_ratio":1.0344571369779,"pps":0.425238229129262,"storage":9.34764721988102,"time":12.1,"wallet":0.0},{"active_cells":60.5,"ci":0.555344580568961,"ci_bonus":0.027767229028448,"ci_delta":0.00130618829325913,"power_ratio":1.03506895337559,"pps":2.55329467706426,"storage":11.9001106719659,"time":13.1,"wallet":0.0},{"active_cells":63.5,"ci":0.55543360912379,"ci_bonus":0.0277716804561895,"ci_delta":-0.000175493071763122,"power_ratio":1.03567989275457,"pps":2.55481248523861,"storage":14.454253997377,"time":14.1,"wallet":0.0},{"active_cells":66.5,"ci":0.556544300144903,"ci_bonus":0.0278272150072452,"ci_delta":0.000378089616264732,"power_ratio":1.03628988811844,"pps":0.426075836245961,"storage":14.8802085114382,"time":15.1,"wallet":0.0},{"active_cells":70.75,"ci":0.557237797701409,"ci_bonus":0.0278618898850705,"ci_delta":0.000654969125954974,"power_ratio":1.03689887257434,"pps":0.426340548073003,"storage":15.3064254201521,"time":16.1,"wallet":0.0},{"active_cells":74.5,"ci":0.558308235232707,"ci_bonus":0.0279154117616354,"ci_delta":0.000589079516454261,"power_ratio":1.03750677934026,"pps":0.426612652959008,"storage":15.7329128823808,"time":17.1,"wallet":0.0},{"active_cells":78.5,"ci":0.558691370915967,"ci_bonus":0.0279345685457984,"ci_delta":-0.000138700350758469,"power_ratio":1.03811354175237,"pps":0.426870039806606,"storage":16.1596689750425,"time":18.1,"wallet":0.0},{"active_cells":81.5,"ci":0.559005466977458,"ci_bonus":0.0279502733488729,"ci_delta":0.000314096061491131,"power_ratio":1.03871909327234,"pps":0.427125500982888,"storage":16.5866798866306,"time":19.1,"wallet":0.0},{"active_cells":87.0,"ci":0.56037596929428,"ci_bonus":0.028018798464714,"ci_delta":0.000593343182672013,"power_ratio":1.03932336749462,"pps":0.427402402060155,"storage":17.0139643761319,"time":20.1,"wallet":0.0},{"active_cells":90.0,"ci":0.561861919336886,"ci_bonus":0.0280930959668443,"ci_delta":0.000306382037386532,"power_ratio":1.03992629815372,"pps":0.427681182296258,"storage":17.4415302323443,"time":21.1,"wallet":0.0},{"active_cells":92.5,"ci":0.562718081809063,"ci_bonus":0.0281359040904532,"ci_delta":0.000549780434790814,"power_ratio":1.04052781913152,"pps":0.427946308903641,"storage":17.8693577971599,"time":22.1,"wallet":0.0},{"active_cells":93.0,"ci":0.563512970031258,"ci_bonus":0.0281756485015629,"ci_delta":0.000347222222222165,"power_ratio":1.04112786446445,"pps":0.428209570546109,"storage":18.2974494726502,"time":23.1000000000001,"wallet":0.0},{"active_cells":96.25,"ci":0.562578752820545,"ci_bonus":0.0281289376410273,"ci_delta":-0.000435793097991022,"power_ratio":1.04172636835079,"pps":2.57061712453876,"storage":18.9400024133153,"time":24.1000000000001,"wallet":0.0},{"active_cells":101.75,"ci":0.563279780399021,"ci_bonus":0.028163989019951,"ci_delta":0.000524124900348921,"power_ratio":1.04232326515783,"pps":2.57217725630825,"storage":21.5114583154237,"time":25.1000000000001,"wallet":0.0},{"active_cells":105.5,"ci":0.565011531664778,"ci_bonus":0.0282505765832389,"ci_delta":0.00109497679218018,"power_ratio":1.04291848942911,"pps":0.428977057952368,"storage":23.8700164995565,"time":26.1000000000001,"wallet":0.0},{"active_cells":108.25,"ci":0.564449638161243,"ci_bonus":0.0282224819080622,"ci_delta":-0.000561893503534971,"power_ratio":1.0435119758916,"pps":0.429209358603714,"storage":24.2991207977844,"time":27.1000000000001,"wallet":0.0},{"active_cells":115.0,"ci":0.565255138010317,"ci_bonus":0.0282627569005158,"ci_delta":0.000722860754260868,"power_ratio":1.0441036594628,"pps":0.429469457382062,"storage":24.7284732937327,"time":28.1000000000001,"wallet":0.0},{"active_cells":122.5,"ci":0.566302336986041,"ci_bonus":0.0283151168493021,"ci_delta":0.000899925338487928,"power_ratio":1.04469347525795,"pps":0.429733854612972,"storage":25.1580867970545,"time":29.1000000000001,"wallet":0.0},{"active_cells":129.75,"ci":0.567234944252968,"ci_bonus":0.0283617472126484,"ci_delta":0.000393036265650237,"power_ratio":1.0452813585971,"pps":0.42999508323026,"storage":25.5879671074159,"time":30.1000000000002,"wallet":0.0},{"active_cells":135.0,"ci":0.569222372261473,"ci_bonus":0.0284611186130737,"ci_delta":0.00115702628443892,"power_ratio":1.04586724501221,"pps":0.430277574945243,"storage":26.0181159189141,"time":31.1000000000002,"wallet":0.0},{"active_cells":137.25,"ci":0.570235058712097,"ci_bonus":0.0285117529356048,"ci_delta":0.00031344953843182,"power_ratio":1.04645107025424,"pps":0.430538861042751,"storage":26.4485386327477,"time":32.1000000000002,"wallet":0.0},{"active_cells":141.0,"ci":0.570224922306013,"ci_bonus":0.0285112461153007,"ci_delta":0.000411408703722915,"power_ratio":1.04703277030017,"pps":0.430777874024999,"storage":26.8792046856789,"time":33.1000000000002,"wallet":0.0},{"active_cells":145.25,"ci":0.570271917876746,"ci_bonus":0.0285135958938373,"ci_delta":-0.000190802021878711,"power_ratio":1.04761228136004,"pps":0.431017180703537,"storage":27.3101163017677,"time":34.1000000000002,"wallet":0.0},{"active_cells":146.5,"ci":0.571301554383936,"ci_bonus":0.0285650777191968,"ci_delta":0.00102963650719001,"power_ratio":1.04818953988392,"pps":0.431276160165436,"storage":27.7412770764525,"time":35.1000000000002,"wallet":0.0},{"active_cells":150.5,"ci":0.571117462732169,"ci_bonus":0.0285558731366084,"ci_delta":-0.0000612003762983093,"power_ratio":1.04876448256892,"pps":2.5890524895445,"storage":28.3884345189627,"time":36.1000000000002,"wallet":0.0},{"active_cells":155.75,"ci":0.571056923330054,"ci_bonus":0.0285528461665027,"ci_delta":-0.000478837679876776,"power_ratio":1.04933704636609,"pps":2.59045766346416,"storage":30.9782930840056,"time":37.1000000000003,"wallet":0.0},{"active_cells":161.75,"ci":0.572107480446995,"ci_bonus":0.0286053740223497,"ci_delta":0.000668044219996111,"power_ratio":1.04990716848736,"pps":0.4319994632746,"storage":33.3536022651316,"time":38.1000000000003,"wallet":0.0},{"active_cells":165.0,"ci":0.573689475909838,"ci_bonus":0.0286844737954919,"ci_delta":0.000979149043574545,"power_ratio":1.05047478641241,"pps":0.432266139488608,"storage":33.7857431845897,"time":39.1000000000003,"wallet":0.0},{"active_cells":165.5,"ci":0.574091746603695,"ci_bonus":0.0287045873301847,"ci_delta":0.000402270693856677,"power_ratio":1.05103983789554,"pps":0.432506992860985,"storage":34.2181431493415,"time":40.1000000000003,"wallet":0.0},{"active_cells":167.0,"ci":0.573906713858444,"ci_bonus":0.0286953356929222,"ci_delta":-0.000240081216884791,"power_ratio":1.05160226097249,"pps":0.432734418364099,"storage":34.6507760902186,"time":41.1000000000003,"wallet":0.0},{"active_cells":169.5,"ci":0.573825882363878,"ci_bonus":0.0286912941181939,"ci_delta":-0.00018797249990421,"power_ratio":1.05216199396723,"pps":0.432962923123533,"storage":35.0836382818576,"time":42.1000000000003,"wallet":0.0},{"active_cells":173.5,"ci":0.573541663166655,"ci_bonus":0.0286770831583328,"ci_delta":-0.000443468919540391,"power_ratio":1.05271897549873,"pps":0.433186008969307,"storage":35.5167271691318,"time":43.1000000000003,"wallet":0.0},{"active_cells":178.0,"ci":0.574338727721705,"ci_bonus":0.0287169363860852,"ci_delta":0.000546089030145636,"power_ratio":1.05327314448768,"pps":0.433430707654341,"storage":35.9500429461366,"time":44.1000000000004,"wallet":0.0},{"active_cells":182.0,"ci":0.573332597785764,"ci_bonus":0.0286666298892882,"ci_delta":-0.00100612993594051,"power_ratio"